{"$schema":"https://json-schema.org/draft/2020-12/schema","$id":"https://axm.tools/schemas/deep-tech-governed-state-v1.json","title":"AXM Deep-Tech Governed State","type":"object","additionalProperties":false,"required":["schema","target_selection","meta","sources","actors","relationships","instruments","claims","evidence","capabilities","rights","authorities","decisions","exceptions","qualification_plans","stress_scenarios","lineage","successor_events"],"properties":{"schema":{"const":"axm/deep-tech-governed-state@1"},"target_selection":{"type":"object","additionalProperties":false,"required":["target_id","target_label","selected_by","selection_receipt","automatic_selection"],"properties":{"target_id":{"type":"string","minLength":1},"target_label":{"type":"string","minLength":1},"selected_by":{"type":"string","minLength":1},"selection_receipt":{"type":"string","minLength":1},"automatic_selection":{"const":false}}},"meta":{"type":"object","required":["as_of","sector_pack","public_only"],"properties":{"as_of":{"type":"string"},"sector_pack":{"const":"AXM-DEEPTECH-001"},"public_only":{"type":"boolean"}},"additionalProperties":true},"actors":{"type":"array","items":{"$ref":"#/$defs/object"}},"relationships":{"type":"array","items":{"$ref":"#/$defs/object"}},"instruments":{"type":"array","items":{"$ref":"#/$defs/object"}},"claims":{"type":"array","items":{"$ref":"#/$defs/claim"}},"evidence":{"type":"array","items":{"$ref":"#/$defs/evidence"}},"capabilities":{"type":"array","items":{"$ref":"#/$defs/object"}},"rights":{"type":"array","items":{"$ref":"#/$defs/object"}},"authorities":{"type":"array","items":{"$ref":"#/$defs/object"}},"decisions":{"type":"array","items":{"$ref":"#/$defs/object"}},"exceptions":{"type":"array","items":{"$ref":"#/$defs/exception"}},"qualification_plans":{"type":"array","items":{"$ref":"#/$defs/object"}},"stress_scenarios":{"type":"array","items":{"$ref":"#/$defs/object"}},"lineage":{"type":"array","items":{"$ref":"#/$defs/object"}},"successor_events":{"type":"array","items":{"$ref":"#/$defs/object"}},"sources":{"type":"array","items":{"$ref":"#/$defs/source"}}},"$defs":{"object":{"type":"object","required":["id"],"properties":{"id":{"type":"string","minLength":1}},"additionalProperties":true},"claim":{"type":"object","required":["id","state","text","source_refs","allowed_language","prohibited_upgrade"],"properties":{"id":{"type":"string"},"state":{"enum":["SOURCE_ONLY","HELD","CORROBORATED","QUALIFIED","STALE","WITHDRAWN"]},"text":{"type":"string"},"source_refs":{"type":"array","items":{"type":"string"}},"allowed_language":{"type":"string"},"prohibited_upgrade":{"type":"string"},"risk":{"enum":["low","medium","high","critical"]}},"additionalProperties":true},"evidence":{"type":"object","required":["id","state","source_refs","proves","does_not_prove"],"properties":{"id":{"type":"string"},"state":{"enum":["OBSERVED","ADMITTED","QUALIFIED","HELD","STALE"]},"source_refs":{"type":"array","items":{"type":"string"}},"proves":{"type":"array","items":{"type":"string"}},"does_not_prove":{"type":"array","items":{"type":"string"}}},"additionalProperties":true},"exception":{"type":"object","required":["id","severity","status","failure_mode"],"properties":{"id":{"type":"string"},"severity":{"enum":["low","medium","high","critical"]},"status":{"enum":["OPEN","HELD","MITIGATED","CLOSED","STALE"]},"failure_mode":{"type":"string"}},"additionalProperties":true},"source":{"type":"object","required":["schema","source_id","target_id","source_class","locator","title","observed_at","capture_mode","public_source","authority_scope","nonclaims"],"properties":{"schema":{"const":"axm/deep-tech-source-receipt@1"},"source_id":{"type":"string"},"target_id":{"type":"string"},"source_class":{"enum":["PRIMARY_FIRST_PARTY","INDEPENDENT_PRIMARY","OFFICIAL_RECORD","SECONDARY","DISCOVERY_LEAD"]},"locator":{"type":"string"},"title":{"type":"string"},"observed_at":{"type":"string"},"capture_mode":{"enum":["METADATA_ONLY","LOCAL_BYTES"]},"public_source":{"const":true},"content_sha256":{"type":"string"},"content_bytes":{"type":"integer"},"authority_scope":{"type":"string"},"nonclaims":{"type":"array","items":{"type":"string"}}},"additionalProperties":true}}}
