{"schema":"axm/deep-tech-governed-state@1","target_selection":{"target_id":"SYNTHETIC-AIR-001","target_label":"Asterion Aerial Systems (synthetic)","selected_by":"synthetic-fixture","selection_receipt":"SYNTHETIC-FIXTURE-ONLY","automatic_selection":false},"meta":{"as_of":"2026-09-07","sector_pack":"AXM-DEEPTECH-001","public_only":true},"actors":[{"id":"ACT-001","label":"Synthetic aerial startup"},{"id":"ACT-002","label":"Synthetic test-range partner"}],"relationships":[{"id":"REL-001","state":"reported_partner","actor_refs":["ACT-001","ACT-002"]}],"instruments":[{"id":"INS-001","state":"REPORTED","binding":"unknown","source_refs":["SRC-A01"]}],"claims":[{"id":"CLM-001","state":"CORROBORATED","text":"The startup was selected for a public flight demonstration program.","source_refs":["SRC-A01","SRC-A02"],"allowed_language":"The startup was publicly listed as selected for the demonstration program.","prohibited_upgrade":"Do not call selection a contract, award, procurement, customer, or deployment.","risk":"high"},{"id":"CLM-002","state":"SOURCE_ONLY","text":"The startup reports autonomous route planning in simulation.","source_refs":["SRC-A03"],"allowed_language":"The startup reports simulated autonomous route planning.","prohibited_upgrade":"Do not claim field autonomy or operational performance from simulation.","risk":"critical"}],"evidence":[{"id":"EVD-001","state":"OBSERVED","source_refs":["SRC-A01","SRC-A02"],"proves":["program selection was publicly listed"],"does_not_prove":["contract award","procurement","customer adoption"]},{"id":"EVD-002","state":"OBSERVED","source_refs":["SRC-A03"],"proves":["issuer published simulation result"],"does_not_prove":["field performance","safety acceptance","deployment"]}],"capabilities":[{"id":"CAP-001","state":"Simulation demonstrated","owner_ref":"ACT-001"}],"rights":[{"id":"RGT-001","state":"UNKNOWN","right_type":"data"}],"authorities":[{"id":"AUT-001","state":"UNKNOWN","scope":"technical_acceptance"}],"decisions":[{"id":"DEC-001","state":"HELD","reason":"flight acceptance authority unresolved"}],"exceptions":[{"id":"EXC-001","severity":"critical","status":"OPEN","failure_mode":"simulation could be promoted to field autonomy"},{"id":"EXC-002","severity":"high","status":"OPEN","failure_mode":"program selection could be promoted to procurement"}],"qualification_plans":[{"id":"QPL-001","claim_ref":"CLM-002","requires":["field configuration","telemetry","acceptance criteria","independent witness"]}],"stress_scenarios":[{"id":"STR-001","name":"Selection-to-award inflation","expected":"reject upgrade"}],"lineage":[{"id":"LIN-001","event":"synthetic aerial fixture created"}],"successor_events":[],"sources":[{"schema":"axm/deep-tech-source-receipt@1","source_id":"SRC-A01","target_id":"SYNTHETIC-AIR-001","source_class":"PRIMARY_FIRST_PARTY","locator":"https://example.invalid/aerial/selection","title":"Synthetic issuer selection notice","observed_at":"2026-09-07","capture_mode":"METADATA_ONLY","public_source":true,"authority_scope":"synthetic fixture attribution only","nonclaims":["Synthetic fixture; not a real-world source."]},{"schema":"axm/deep-tech-source-receipt@1","source_id":"SRC-A02","target_id":"SYNTHETIC-AIR-001","source_class":"OFFICIAL_RECORD","locator":"https://example.invalid/aerial/program","title":"Synthetic official program record","observed_at":"2026-09-07","capture_mode":"METADATA_ONLY","public_source":true,"authority_scope":"synthetic fixture attribution only","nonclaims":["Synthetic fixture; not a real-world source."]},{"schema":"axm/deep-tech-source-receipt@1","source_id":"SRC-A03","target_id":"SYNTHETIC-AIR-001","source_class":"PRIMARY_FIRST_PARTY","locator":"https://example.invalid/aerial/simulation","title":"Synthetic simulation report","observed_at":"2026-09-07","capture_mode":"METADATA_ONLY","public_source":true,"authority_scope":"synthetic fixture attribution only","nonclaims":["Synthetic fixture; not a real-world source."]}]}
