{"schema":"axm/deep-tech-governed-state@1","target_selection":{"target_id":"SYNTHETIC-DEF-001","target_label":"Forgepoint Defense Systems (synthetic)","selected_by":"synthetic-fixture","selection_receipt":"SYNTHETIC-FIXTURE-ONLY","automatic_selection":false},"meta":{"as_of":"2026-09-07","sector_pack":"AXM-DEEPTECH-001","public_only":true},"actors":[{"id":"ACT-001","label":"Synthetic defense hardware startup"},{"id":"ACT-002","label":"Synthetic manufacturer"},{"id":"ACT-003","label":"Synthetic government program"}],"relationships":[{"id":"REL-001","state":"reported_manufacturing_partner","actor_refs":["ACT-001","ACT-002"]}],"instruments":[{"id":"INS-001","state":"REPORTED","instrument_type":"government_award","ceiling_usd":1500000,"source_refs":["SRC-D01"]}],"claims":[{"id":"CLM-001","state":"CORROBORATED","text":"A government program lists an award with a ceiling of $1.5 million.","source_refs":["SRC-D01","SRC-D02"],"allowed_language":"The public award record lists a $1.5 million ceiling.","prohibited_upgrade":"Do not call the ceiling recognized revenue, cash received, or completed work.","risk":"critical"},{"id":"CLM-002","state":"SOURCE_ONLY","text":"The startup names a manufacturing partner for scale-up.","source_refs":["SRC-D03"],"allowed_language":"The startup publicly names a manufacturing partner.","prohibited_upgrade":"Do not attribute partner capacity, quality certifications, owned tooling, or production readiness to the startup.","risk":"high"}],"evidence":[{"id":"EVD-001","state":"OBSERVED","source_refs":["SRC-D01","SRC-D02"],"proves":["public award ceiling"],"does_not_prove":["revenue recognized","cash received","deliverables accepted"]},{"id":"EVD-002","state":"OBSERVED","source_refs":["SRC-D03"],"proves":["issuer names manufacturing partner"],"does_not_prove":["owned capacity","completed transfer","qualified production"]}],"capabilities":[{"id":"CAP-001","state":"Prototype demonstrated","owner_ref":"ACT-001"},{"id":"CAP-002","state":"Production capability reported","owner_ref":"ACT-002"}],"rights":[{"id":"RGT-001","state":"UNKNOWN","right_type":"manufacturing"}],"authorities":[{"id":"AUT-001","state":"UNKNOWN","scope":"bind"}],"decisions":[{"id":"DEC-001","state":"HELD","reason":"production acceptance evidence absent"}],"exceptions":[{"id":"EXC-001","severity":"critical","status":"OPEN","failure_mode":"contract ceiling could be promoted to revenue"},{"id":"EXC-002","severity":"high","status":"OPEN","failure_mode":"partner capacity could be promoted to startup-owned capacity"}],"qualification_plans":[{"id":"QPL-001","claim_ref":"CLM-001","requires":["invoice or payment record","accepted deliverable record","accounting treatment"]}],"stress_scenarios":[{"id":"STR-001","name":"Ceiling-to-revenue inflation","expected":"reject upgrade"}],"lineage":[{"id":"LIN-001","event":"synthetic defense hardware fixture created"}],"successor_events":[],"sources":[{"schema":"axm/deep-tech-source-receipt@1","source_id":"SRC-D01","target_id":"SYNTHETIC-DEF-001","source_class":"OFFICIAL_RECORD","locator":"https://example.invalid/defense/award","title":"Synthetic award record","observed_at":"2026-09-07","capture_mode":"METADATA_ONLY","public_source":true,"authority_scope":"synthetic fixture attribution only","nonclaims":["Synthetic fixture; not a real-world source."]},{"schema":"axm/deep-tech-source-receipt@1","source_id":"SRC-D02","target_id":"SYNTHETIC-DEF-001","source_class":"INDEPENDENT_PRIMARY","locator":"https://example.invalid/defense/program","title":"Synthetic program corroboration","observed_at":"2026-09-07","capture_mode":"METADATA_ONLY","public_source":true,"authority_scope":"synthetic fixture attribution only","nonclaims":["Synthetic fixture; not a real-world source."]},{"schema":"axm/deep-tech-source-receipt@1","source_id":"SRC-D03","target_id":"SYNTHETIC-DEF-001","source_class":"PRIMARY_FIRST_PARTY","locator":"https://example.invalid/defense/manufacturing","title":"Synthetic manufacturing announcement","observed_at":"2026-09-07","capture_mode":"METADATA_ONLY","public_source":true,"authority_scope":"synthetic fixture attribution only","nonclaims":["Synthetic fixture; not a real-world source."]}]}
