{"schema":"axm/deep-tech-governed-state@1","target_selection":{"target_id":"SYNTHETIC-ROB-001","target_label":"RelayWorks Robotics (synthetic)","selected_by":"synthetic-fixture","selection_receipt":"SYNTHETIC-FIXTURE-ONLY","automatic_selection":false},"meta":{"as_of":"2026-09-07","sector_pack":"AXM-DEEPTECH-001","public_only":true},"actors":[{"id":"ACT-001","label":"Synthetic industrial robotics startup"},{"id":"ACT-002","label":"Synthetic pilot site"}],"relationships":[{"id":"REL-001","state":"reported_pilot","actor_refs":["ACT-001","ACT-002"]}],"instruments":[{"id":"INS-001","state":"UNKNOWN","instrument_type":"pilot","source_refs":["SRC-R01"]}],"claims":[{"id":"CLM-001","state":"CORROBORATED","text":"A public repository contains software attributed to the startup.","source_refs":["SRC-R01","SRC-R02"],"allowed_language":"An attributable public repository exists for the named software.","prohibited_upgrade":"Do not infer that the public repository is the deployed production code or complete software lineage.","risk":"high"},{"id":"CLM-002","state":"SOURCE_ONLY","text":"The startup reports a pilot at an industrial site.","source_refs":["SRC-R03"],"allowed_language":"The startup reports a pilot at an industrial site.","prohibited_upgrade":"Do not call the pilot customer adoption, production deployment, recurring revenue, or accepted performance.","risk":"critical"}],"evidence":[{"id":"EVD-001","state":"OBSERVED","source_refs":["SRC-R01","SRC-R02"],"proves":["attributable public code exists"],"does_not_prove":["deployed revision","complete dependency lineage","production configuration"]},{"id":"EVD-002","state":"OBSERVED","source_refs":["SRC-R03"],"proves":["issuer reports pilot"],"does_not_prove":["customer acceptance","production deployment","revenue"]}],"capabilities":[{"id":"CAP-001","state":"Pilot reported","owner_ref":"ACT-001"}],"rights":[{"id":"RGT-001","state":"UNKNOWN","right_type":"background_ip"}],"authorities":[{"id":"AUT-001","state":"UNKNOWN","scope":"publish"}],"decisions":[{"id":"DEC-001","state":"HELD","reason":"deployed code revision and customer acceptance unresolved"}],"exceptions":[{"id":"EXC-001","severity":"critical","status":"OPEN","failure_mode":"pilot could be promoted to production deployment"},{"id":"EXC-002","severity":"high","status":"OPEN","failure_mode":"public repository could be promoted to deployed code lineage"}],"qualification_plans":[{"id":"QPL-001","claim_ref":"CLM-002","requires":["pilot instrument","configuration manifest","acceptance criteria","customer-controlled result"]}],"stress_scenarios":[{"id":"STR-001","name":"Pilot-to-adoption inflation","expected":"reject upgrade"}],"lineage":[{"id":"LIN-001","event":"synthetic industrial robotics fixture created"}],"successor_events":[],"sources":[{"schema":"axm/deep-tech-source-receipt@1","source_id":"SRC-R01","target_id":"SYNTHETIC-ROB-001","source_class":"PRIMARY_FIRST_PARTY","locator":"https://example.invalid/robotics/repository","title":"Synthetic repository attribution","observed_at":"2026-09-07","capture_mode":"METADATA_ONLY","public_source":true,"authority_scope":"synthetic fixture attribution only","nonclaims":["Synthetic fixture; not a real-world source."]},{"schema":"axm/deep-tech-source-receipt@1","source_id":"SRC-R02","target_id":"SYNTHETIC-ROB-001","source_class":"INDEPENDENT_PRIMARY","locator":"https://example.invalid/robotics/repository-corroboration","title":"Synthetic repository corroboration","observed_at":"2026-09-07","capture_mode":"METADATA_ONLY","public_source":true,"authority_scope":"synthetic fixture attribution only","nonclaims":["Synthetic fixture; not a real-world source."]},{"schema":"axm/deep-tech-source-receipt@1","source_id":"SRC-R03","target_id":"SYNTHETIC-ROB-001","source_class":"PRIMARY_FIRST_PARTY","locator":"https://example.invalid/robotics/pilot","title":"Synthetic pilot announcement","observed_at":"2026-09-07","capture_mode":"METADATA_ONLY","public_source":true,"authority_scope":"synthetic fixture attribution only","nonclaims":["Synthetic fixture; not a real-world source."]}]}
